{
  "schema_version": 1,
  "change_id": "WIDGET-CR-2026-0421-A",
  "customer": "widget-corp",
  "inventory_adapter": "file",
  "inventory_source_fingerprint": "sha256:e3d4193514f13eaa97fcb8d60ceb50857d82388c65ad897c9e4d9e7dc40dca1f",
  "generated_at": "2026-04-21T00:00:00Z",
  "tenants": ["retail-ops"],
  "services": [
    {
      "id": "orders-api",
      "criticality": "tier-1",
      "rto_band": "5m-1h",
      "owner_tenant": "retail-ops"
    },
    {
      "id": "checkout-web",
      "criticality": "tier-1",
      "rto_band": "lt-5m",
      "owner_tenant": "retail-ops"
    }
  ],
  "direct_devices": [
    {
      "id": "dc1-edge-01",
      "role": "edge-router",
      "site": "dc1"
    }
  ],
  "dependencies": [
    {
      "from": "orders-api",
      "to": "dc1-edge-01",
      "type": "routes-via"
    },
    {
      "from": "checkout-web",
      "to": "orders-api",
      "type": "depends-on"
    }
  ],
  "downstream_consumers": [
    {
      "id": "orders-api",
      "kind": "service",
      "distance": 1
    },
    {
      "id": "checkout-web",
      "kind": "service",
      "distance": 2
    },
    {
      "id": "retail-ops",
      "kind": "tenant",
      "distance": 2
    }
  ],
  "rto_band": "lt-5m",
  "confidence": "high",
  "coverage_gaps": []
}
